{
  "leaderboard": {
    "leaderboard": {
      "leaderboard": [
        {
          "athleteId": "athlete_1",
          "points": 0,
          "laps": 0
        },
        {
          "athleteId": "athlete_2",
          "points": 0,
          "laps": 0
        },
        {
          "athleteId": "athlete_3",
          "points": 0,
          "laps": 0
        },
        {
          "athleteId": "athlete_4",
          "points": 0,
          "laps": 0
        },
        {
          "athleteId": "athlete_5",
          "points": 0,
          "laps": 0
        },
        {
          "athleteId": "athlete_6",
          "points": 0,
          "laps": 0
        },
        {
          "athleteId": "athlete_7",
          "points": 0,
          "laps": 0
        },
        {
          "athleteId": "athlete_8",
          "points": 0,
          "laps": 0
        },
        {
          "athleteId": "athlete_9",
          "points": 0,
          "laps": 0
        },
        {
          "athleteId": "athlete_10",
          "points": 0,
          "laps": 0
        },
        {
          "athleteId": "athlete_11",
          "points": 0,
          "laps": 0
        },
        {
          "athleteId": "athlete_12",
          "points": 0,
          "laps": 0
        }
      ]
    },
    "stories": {
      "stories": []
    },
    "commentary": []
  },
  "stories": [],
  "commentary": [],
  "timestamp": 1757658528192
}